Name,Address,State,County,Phone,Email,Website,Category,Facility_Type,Feedstock,Latitude,Longitude,NAICS_Code
"METech Recycling, Inc.","1803 N Main St., Roxboro, NC, United States",North Carolina, , , ,www.metechrecycling.com,Electronics Recyclers,Electronics Recycler,Electronics,36.431454995848,-78.9673349908401,562920
"METech Recycling, Inc.","369 Orange Street, Salt Lake City, UT, United States",Utah, , , ,www.metechrecycling.com,Electronics Recyclers,Electronics Recycler,Electronics,40.7617890000165,-111.942462004694,562920
"METech Recycling, Inc.","6200 Engle Way, Gilroy, CA, United States",California, , , , ,Electronics Recyclers,Electronics Recycler,Electronics,36.9901549848681,-121.554033961871,562920
"Metro Metals Northwest, Inc.","2202 East River Street, Tacoma, WA, United States",Washington, , , ,www.metrometalsnw.com,Electronics Recyclers,Electronics Recycler,Electronics,47.2475349797159,-122.417588002243,562920
"Metro Metals Northwest, INC.","2401 Saint Francis Lane, Vancouver, WA, United States",Washington, , , ,www.metrometalsnw.com,Electronics Recyclers,Electronics Recycler,Electronics,45.6386820160033,-122.695956035841,562920
Minnesota Computers for Schools,"504 Malcolm Avenue SE, Suite 100, Minneapolis, MN, United States",Minnesota, , , ,www.mncfs.org,Electronics Recyclers,Electronics Recycler,Electronics,44.9720939830748,-93.2091389937369,562920
MJ Trading LLC,"12807 Royal DR #108, Stafford, TX, United States",Texas, , , ,http://www.mjtechtrade.com,Electronics Recyclers,Electronics Recycler,Electronics,29.6339240109706,-95.5780250092866,562920
Mobilcom Retail LLC,"19555, 19557, 19575 NE 10th Avenue, North Miami, FL, United States",Florida, , , , ,Electronics Recyclers,Electronics Recycler,Electronics,25.8995169161154,-80.1788020399119,562920
MobileSquare,"1801 Royal Lane, Suite 906, Farmers Branch, TX, United States",Texas, , , ,www.mobilesquare.com,Electronics Recyclers,Electronics Recycler,Electronics,32.8973600095591,-96.916861039082,562920
Mobitech Group,"2 Goument Lane, Edison, NJ, United States",New Jersey, , , , ,Electronics Recyclers,Electronics Recycler,Electronics,40.5305500000001,-74.38114,562920
Monitor & CRT Recyclers of CA,"1691 N. Delilah St., Corona, CA, United States",California, , , , ,Electronics Recyclers,Electronics Recycler,Electronics,33.8815399882764,-117.534152994647,562920
Monmouth Wire & Computer Recycling,"3250 Shafto Road, Tinton Falls, NJ, United States",New Jersey, , , ,www.computerreclamation.com,Electronics Recyclers,Electronics Recycler,Electronics,40.2310269839275,-74.1116350302992,562920
"MRC I, LLC DBA MRC Recycling","3751 Old State Road M, Imperial, MO, United States",Missouri, , , ,mrcrecycling.net,Electronics Recyclers,Electronics Recycler,Electronics,38.3667389994332,-90.4737019587651,562920
"MRC I, LLC DBA MRC Recycling","915 5th Street, Park Hills, MO, United States",Missouri, , , , ,Electronics Recyclers,Electronics Recycler,Electronics,37.8545400071212,-90.4979079731265,562920
MRK Group Ltd.,"801 North State Street, Unit C, Elgin, IL, United States",Illinois, , , ,WWW.MRKGROUPLTD.COM,Electronics Recyclers,Electronics Recycler,Electronics,42.0531899957235,-88.2948470154287,562920
"N.F. Smith & Associates, L.P.","8820 Clay Road Suite 200, Houston, TX, United States",Texas, , , ,www.smithweb.com,Electronics Recyclers,Electronics Recycler,Electronics,29.8328123058227,-95.5125918198289,562920
National Computer Liquidators dba IT Asset Management Group dba RefurbConnect,"110 Bi County Blvd., Suite 106, Farmingdale, NY, United States",New York, , , ,itamg.com,Electronics Recyclers,Electronics Recycler,Electronics,40.7263987188815,-73.4289421762475,562920
"Natural Evolution, Inc.","5701 East 13th St., Tulsa, OK, 74112",Oklahoma, ,(918) 836-2995,recycle@naturalevolution.com,http://www.naturalevolution.com/,Electronics Recyclers,Electronics Recycler,Electronics,36.1442886414729,-95.9134706184921,562920
NCS Global Services LLC,"32 Innovation Drive, Rochester, NH, 03867",New Hampshire, ,(603) 926-4300,info@ncsglobalinc.com,https://ncsglobalinc.com/,Electronics Recyclers,Electronics Recycler,Electronics,43.2799839942159,-70.9194229966586,562920
Near Recycling,"9685 Gerwig Lane  Suite B, Columbia, MD, United States",Maryland, , , ,WWW.NEARRECYCLING.COM,Electronics Recyclers,Electronics Recycler,Electronics,39.1749140150728,-76.8470480092089,562920
"NERDiT NOW, LLC","1618 W Newport Pk, Wilmington, DE, United States",Delaware, , , ,www.nerditnow.com,Electronics Recyclers,Electronics Recycler,Electronics,39.7146170072791,-75.6279020363595,562920
New Life Tech & Associates,"211 Cottage Street, Poughkeepsie, NY, United States",New York, , , ,www.nltrecovery.com,Electronics Recyclers,Electronics Recycler,Electronics,41.7048183603701,-73.9113213745464,562920
New2U Computers,"50 E. Greg Street, Suite 103, Sparks, NV, United States",Nevada, , , ,http://new2ucomputers.org,Electronics Recyclers,Electronics Recycler,Electronics,39.5222649860766,-119.741864986597,562920
Newtech Recycling,"600A Apgar Dr, Somerset, NJ, United States",New Jersey, , , , ,Electronics Recyclers,Electronics Recycler,Electronics,40.5414584908377,-74.5529492961765,562920
"NexTech Operations, LLC","339 Cross Park Drive, Pearl, MS, United States",Mississippi, , , ,www.nextechpartners.com,Electronics Recyclers,Electronics Recycler,Electronics,32.2866369841093,-90.043201041428,562920
Norris Technologies,"2659 Nova Dr., Dallas, TX, United States",Texas, , , ,www.norris1.com,Electronics Recyclers,Electronics Recycler,Electronics,32.90607299791,-96.8880019788108,562920
Norris Technologies,"350 JD Yarnell Industrial Pkwy, Clinton, TN, United States",Tennessee, , , ,http://www.norris1.com/,Electronics Recyclers,Electronics Recycler,Electronics,36.0986579843325,-84.1021160334824,562920
"North Coast Services, LLC","44 Locke Rd., Concord, NH, 03301",New Hampshire, ,(603) 610-7901,info@ncoastllc.com,http://ncoastllc.com/,Electronics Recyclers,Electronics Recycler,Electronics,43.2461280204571,-71.5468249616897,562920
North Georgia Telecom Inc,"4200 Steve Reynolds Blvd  Ste 14, Norcross, GA, United States",Georgia, , , ,www.ngtinc.com,Electronics Recyclers,Electronics Recycler,Electronics,33.9297138872555,-84.1469465436367,562920
NorthStar Mobile,"80 Milltown Rd, Union, NJ, United States",New Jersey, , , , ,Electronics Recyclers,Electronics Recycler,Electronics,40.6935010062035,-74.3041629876495,562920
NovaStar Solution.com LLC dba Playitagainpc,"35200 Plymouth Rd, Livonia, MI, United States",Michigan, , , , ,Electronics Recyclers,Electronics Recycler,Electronics,42.3686979908351,-83.3888190069184,562920
"Novus Solutions, LLC","925 Industrial Park Drive, Marietta, GA, United States",Georgia, , , ,www.novussolutionsllc.com,Electronics Recyclers,Electronics Recycler,Electronics,33.9742629900455,-84.5384530185435,562920
O & M Electronic Inc.,"5451 W 110th Street
Unit 4, Oak Lawn, IL, United States",Illinois, , , ,www.om-electronics.com,Electronics Recyclers,Electronics Recycler,Electronics,41.6918129994031,-87.7559089976157,562920
"Ocean Enterprises, LLC","9940 Hamilton Rd, Eden Prairie, MN, United States",Minnesota, , , ,oceantech.com,Electronics Recyclers,Electronics Recycler,Electronics,44.8812680155417,-93.40237396462,562920
"Ocean Enterprises, LLC DBA OceanTech","1313 Winter St NE, Minneapolis, MN, United States",Minnesota, , , ,www.oceantechonline.com,Electronics Recyclers,Electronics Recycler,Electronics,44.9937829957315,-93.2329509748299,562920
Oceanside Electronics Inc,"315 Angle Rd, Ft Pierce, FL, United States",Florida, , , , ,Electronics Recyclers,Electronics Recycler,Electronics,27.450350014237,-80.3601690010913,562920
"OEM Source, Inc.","140 58th Street #4G, Brooklyn, NY, United States",New York, , , ,www.oemsourceinc.com,Electronics Recyclers,Electronics Recycler,Electronics,40.6455576096873,-74.0238575609512,562920
Office Management Systems dba Logista,"401 Yorkville Rd. E., Columbus, MS, United States",Mississippi, , , ,www.logistasolutions.com,Electronics Recyclers,Electronics Recycler,Electronics,33.4790049975175,-88.3819779885849,562920
"Office Recycling Solutions, LLC","1372 Main St., Coventry, RI, United States",Rhode Island, , , ,www.OfficeRecyclingSolutions.com,Electronics Recyclers,Electronics Recycler,Electronics,41.6947330030123,-71.5758990177771,562920
OG Wireless Inc DBA JD Mobile DBA Cell4Cash,"2927 Avenue U Parking Lot Back Door, Brooklyn, NY, United States",New York, , , , ,Electronics Recyclers,Electronics Recycler,Electronics,40.6004784244619,-73.9419655436809,562920
"Ombligo, Inc. dba TechMikeNY","4014 1st Ave Unit 16, 5th Floor SW, Brooklyn, NY, United States",New York, , , ,www.ombligo.com,Electronics Recyclers,Electronics Recycler,Electronics,40.6558602259754,-74.0136916535039,562920
OmniSource Electronics Recycling LLC,"219 Murray St., Fort Wayne, IN, United States",Indiana, , , ,www.omniescrap.com,Electronics Recyclers,Electronics Recycler,Electronics,41.0709049976762,-85.135284003399,562920
Onsite Electronics Recycling,"2331 N. Teepee Drive, Stockton, CA, 95205",California, ,(209) 234-7994,onsiterecycling@myoer.com,http://www.onsiteelectronicsrecycling.com/,Electronics Recyclers,Electronics Recycler,Electronics,37.9850549986517,-121.253369982007,562920
"Onsite Electronics Recycling, LLC DBA I.T. Refresh","100 N. Link Lane, Unit 100, Fort Collins, CO, United States",Colorado, , , ,www.itrefresh.org,Electronics Recyclers,Electronics Recycler,Electronics,40.5866430143764,-105.04901602168,562920
Oscar Winski eRecycling,"1449 Veterans Memorial Pkwy, Lafayette, IN, United States",Indiana, , , ,http://www.oscarwinski.com/erecycling,Electronics Recyclers,Electronics Recycler,Electronics,40.397450006752,-86.8076610224357,562920
Owl Electronic Recycling Inc.,"668 Gravel Pike Suite# 300, East Greenville, PA, United States",Pennsylvania, , , , ,Electronics Recyclers,Electronics Recycler,Electronics,40.4153389997853,-75.5148429868346,562920
Pacific Hide & Fur Depot dba Pacific Steel & Recycling dba Pacific E-Recycling,"1508 11th Avenue North, Nampa, ID, United States",Idaho, , , ,www.pacific-steel.com,Electronics Recyclers,Electronics Recycler,Electronics,43.5945741709298,-116.540904760613,562920
PADNOS Electronics Recycling,"500 44th St. SW, Suite B, Grand Rapids, MI, United States",Michigan, , , ,www.padnos.com,Electronics Recyclers,Electronics Recycler,Electronics,42.881694982239,-85.6768179804444,562920
"Palco Telecom Service, Inc","290 Dunlop Blvd, Huntsville, AL, United States",Alabama, , , ,www.gotopalco.com,Electronics Recyclers,Electronics Recycler,Electronics,34.6653450100404,-86.7434434615178,562920
Panasystem Corporation,"21540 Prairie St Unit A, Chatsworth, CA, United States",California, , , ,panasystem.com,Electronics Recyclers,Electronics Recycler,Electronics,34.2372939848515,-118.600335018058,562920
Paramount Resource Recycling,"7230 Petterson Lane, Paramount, CA, United States",California, , , , ,Electronics Recyclers,Electronics Recycler,Electronics,33.907163363571,-118.172040185966,562920
"PC Recycler, Inc. dba Securis","14801 Willard Road, Suite 800, Chantilly, VA, United States",Virginia, , , ,www.securis.com,Electronics Recyclers,Electronics Recycler,Electronics,38.8874540053716,-77.4589260190069,562920
PC Recyclers of Idaho,"1260 E. Watertower, Meridian, ID, United States",Idaho, , , ,www.pcidaho.com,Electronics Recyclers,Electronics Recycler,Electronics,43.6009070340548,-116.378531621945,562920
"PC Survivors of Massachusetts, DBA PCS of Massachusetts DBA PCS of Mass","342 Circuit Street Unit 4, Hanover, MA, United States",Massachusetts, , , ,www.pcsmass.com,Electronics Recyclers,Electronics Recycler,Electronics,42.1089911330999,-70.8647227803546,562920
PCs for People,"1481 Marshall Ave, St Paul, MN, United States",Minnesota, , , ,www.pcsforpeople.org,Electronics Recyclers,Electronics Recycler,Electronics,44.9487510113738,-93.1630070103159,562920
PCs for People,"6035 E 38th Ave., Denver, CO, United States",Colorado, , , ,www.pcsforpeople.org,Electronics Recyclers,Electronics Recycler,Electronics,39.7697089937375,-104.918021962474,562920
PCs for People-St. Paul,"2492 Doswell Ave., St Paul, MN, United States",Minnesota, , , ,www.pcsforpeople.org,Electronics Recyclers,Electronics Recycler,Electronics,44.9808120005674,-93.2047619638986,562920
"PCS Wireless, LLC","11 Vreeland Road, Florham Park, NJ, United States",New Jersey, , , ,www.pcsww.com,Electronics Recyclers,Electronics Recycler,Electronics,40.7911749886309,-74.3693199634409,562920
"PCS Wireless, LLC","904 Murray Road, East Hanover, NJ, United States",New Jersey, , , , ,Electronics Recyclers,Electronics Recycler,Electronics,40.8101100012707,-74.3707439649714,562920
"Peach Wireless, LLC","6370-6372 NW 97th Ave, Doral, FL, United States",Florida, , , ,www.peach-wireless.com,Electronics Recyclers,Electronics Recycler,Electronics,25.8308840104523,-80.356931993904,562920
Phobio LLC,"2125 Barrett Park Drive, Suite104, Kennesaw, GA, United States",Georgia, , , ,phobio.com,Electronics Recyclers,Electronics Recycler,Electronics,34.008055009883,-84.5941490049447,562920
Phone Ride Inc,"16920 N Texas Ave, STE C14, Webster, TX, United States",Texas, , , , ,Electronics Recyclers,Electronics Recycler,Electronics,29.5418749980359,-95.1334360405493,562920
PICS Telecom International Corp.,"1920 Lyell Ave., Rochester, NY, United States",New York, , , ,www.picstelecom.com,Electronics Recyclers,Electronics Recycler,Electronics,43.1665819991225,-77.6776329230879,562920
"Pinnacle Data North America, LLC dba Techbuyer","1251 Metropolitan Avenue, Suite 200, West Deptford, NJ, United States",New Jersey, , , ,techbuyer.com/us,Electronics Recyclers,Electronics Recycler,Electronics,39.8315599792783,-75.194142989439,562920
"PlanITROI, Inc.","100-10 Ford Road, Denville, NJ, United States",New Jersey, , , ,www.planitroi.com,Electronics Recyclers,Electronics Recycler,Electronics,40.9091230473064,-74.5015907752947,562920
"Platinum Connections Inc. dba CHUBBIESTECH, dba CELLFEEE","3116 20th Ave., Astoria, NY, United States",New York, , , , ,Electronics Recyclers,Electronics Recycler,Electronics,40.7793187027701,-73.90595905199,562920
PN California Inc Warehouse,"14950 Lakewood Blvd Ste B, Bellflower, CA, United States",California, , , ,www.pncalifornia.com,Electronics Recyclers,Electronics Recycler,Electronics,33.8975838411483,-118.142620866111,562920
PN California Inc.,"9016 Somerset Blvd., Bellflower, CA, United States",California, , , , ,Electronics Recyclers,Electronics Recycler,Electronics,33.896015996065,-118.142007020368,562920
POS Remarketing Group,"1215 Henri Drive, Wauconda, IL, United States",Illinois, , , ,www.posrg.com/services/recycling-and-asset-recovery,Electronics Recyclers,Electronics Recycler,Electronics,42.2784937090607,-88.146523287588,562920
Potomac eCycle LLC,"7917 Wellingford Dr, Manassas, VA, United States",Virginia, , , ,www.potomacecycle.com,Electronics Recyclers,Electronics Recycler,Electronics,38.7850019190391,-77.5556226715239,562920
"PowerHouse Recycling, Inc.","1325 Litton Drive, Salisbury, NC, 28147",North Carolina, ,(704) 322-3093,info@powerhouserecycling.com,http://powerhouserecycling.com/,Electronics Recyclers,Electronics Recycler,Electronics,35.609847016451,-80.5541740174191,562920
"PowerHouse Recycling, Inc.","220 Ryan Patrick Drive, Salisbury, NC, 28147",North Carolina, ,(704) 322-3093,info@powerhouserecycling.com,http://powerhouserecycling.com/,Electronics Recyclers,Electronics Recycler,Electronics,35.6179130056957,-80.5486060029587,562920
"PowerON Services, Inc dBA Reuse Inc","8801 Washington Blvd. Suite 101, Roseville, CA, United States",California, , , ,www.poweron.com,Electronics Recyclers,Electronics Recycler,Electronics,38.7881279917379,-121.302551972355,562920
"PPM Recycling, LLC DBA Prime Tech Solutions","7325 Adams Street,, Paramount, CA, United States",California, , , , ,Electronics Recyclers,Electronics Recycler,Electronics,33.8946073388076,-118.170144105298,562920
"Premier Surplus, Inc.","12 Asset Recycling Way, Dawsonville, GA, United States",Georgia, , , ,premiersurplus.com,Electronics Recyclers,Electronics Recycler,Electronics,34.3621490124436,-84.0464910418012,562920
Prism Electronics Corp.,"18305 Sutter Blvd., Morgan Hill, CA, United States",California, , , ,prismelectronics.net,Electronics Recyclers,Electronics Recycler,Electronics,37.1444990146646,-121.655918006625,562920
Procurri LLC,"56 Pembroke Woods Drive, Pembroke, MA, United States",Massachusetts, , , ,https://www.procurri.com/,Electronics Recyclers,Electronics Recycler,Electronics,42.1020774040847,-70.7614907579317,562920
ProSrvc LLC dba Used-Gadget,"17624 15th Ave SE Suite #106A, Bothell, WA, United States",Washington, , , , ,Electronics Recyclers,Electronics Recycler,Electronics,47.8377740168189,-122.212547036918,562920
PTS Electronics dba PTS Corp.,"2000 Liberty Dr, Bloomington, IN, United States",Indiana, , , ,www.ptselectronics.inc,Electronics Recyclers,Electronics Recycler,Electronics,39.1478649848831,-86.5784919944491,562920
Pulse Supply Chain Solutions,"2015 Royal Lane, Ste 470,, Dallas, TX, United States",Texas, , , ,www.pulserecycling.us,Electronics Recyclers,Electronics Recycler,Electronics,32.8957200048976,-96.9094395157436,562920
"Q1, LLC","7651 Southland Blvd, Orlando, FL, United States",Florida, , , ,htts;//q1w.com,Electronics Recyclers,Electronics Recycler,Electronics,28.4541190035894,-81.4055000345248,562920
Quick Ship Brands dba Quick Ship Electronics & dba Preowned Tech,"7826 Allison Ave, Indianapolis, IN, United States",Indiana, , , , ,Electronics Recyclers,Electronics Recycler,Electronics,39.8952820151558,-86.2513850379043,562920
Quick Ship Brands dba Quick Ship Electronics & dba Preowned Tech,"8131 W Bostian Rd, A300, Woodinville, WA, United States",Washington, , , ,quickshipbrands.com,Electronics Recyclers,Electronics Recycler,Electronics,47.7963270143589,-122.125105011335,562920
R.A.K.I. Computers Recycling,"6305 Skyline Drive, Houston, TX, United States",Texas, , , ,www.rakicomp.com,Electronics Recyclers,Electronics Recycler,Electronics,29.7276160026564,-95.4926580076537,562920
R3EWaste,"4202 East Elwood Street, Suite #12, Phoenix, AZ, United States",Arizona, , , ,www.r3ewaste.com,Electronics Recyclers,Electronics Recycler,Electronics,33.4161170029158,-111.990720979865,562920
R3EWaste Austin LLC,"2216 Rutland Drive Suite 2216-B, Austin, TX, United States",Texas, , , ,r3ewaste.com,Electronics Recyclers,Electronics Recycler,Electronics,30.3822640145116,-97.7185250342444,562920
RAE I.T. Asset Management,"3661 S. Pine Avenue, Ocala, FL, United States",Florida, , , ,www.RAEIT.com,Electronics Recyclers,Electronics Recycler,Electronics,29.1518310127556,-82.1200400135107,562920
"RDI, INC","4101 W 42nd Place, Chicago, IL, United States",Illinois, , , , ,Electronics Recyclers,Electronics Recycler,Electronics,41.8157549862823,-87.7270129731516,562920
Reagan Wireless,"720 South Powerline Road, Building 2, Suite D, Deerfield Beach, FL, United States",Florida, , , ,http://www.reaganwireless.com/,Electronics Recyclers,Electronics Recycler,Electronics,26.3073519972652,-80.1498360373778,562920
Reconext,"10000 Alantown Drive, Roseville, CA, United States",California, , , ,teleplan.com,Electronics Recyclers,Electronics Recycler,Electronics,38.7970449956121,-121.303556040536,562920
Reconext,"8860 Industrial Blvd., Roseville, CA, United States",California, , , , ,Electronics Recyclers,Electronics Recycler,Electronics,38.7901639979287,-121.305957036701,562920
Reconext,"8875 Washington Blvd, Suite B, Building #1 TR1, Roseville, CA, United States",California, , , ,Teleplan.com,Electronics Recyclers,Electronics Recycler,Electronics,38.7914910208395,-121.302613998438,562920
"Recycle America Co., L.L.C.","800 Capitol Street, Houston, TX, United States",Texas, , , ,www.wm.com,Electronics Recyclers,Electronics Recycler,Electronics,29.7595880179478,-95.3647530150435,562920
"Recycle Boise, LLC","4725 N. Glenwood Street, Boise, ID, 83714",Idaho, ,(208) 871-9432,contact@recycleboise.com,http://www.recycleboise.com/,Electronics Recyclers,Electronics Recycler,Electronics,43.6473849805293,-116.279637988787,562920
Redstone Computer Inc,"1488 E Mission Blvd., Pomona, CA, United States",California, , , ,www.redstonepc.com,Electronics Recyclers,Electronics Recycler,Electronics,34.0542460019022,-117.726967026352,562920
Refone Trading Inc.,"18-17 College Point Blvd., College Point, NY, United States",New York, , , ,www.refonetrading.com,Electronics Recyclers,Electronics Recycler,Electronics,40.7826353380376,-73.845758044089,562920
"RE-LCD, Inc. / REVIVETECH","2099 Valley View Lane Suite 160, Farmers Branch, TX, United States",Texas, , , ,www.re-lcdinc.com,Electronics Recyclers,Electronics Recycler,Electronics,32.9231330207192,-96.9082649782803,562920
"Repair Center, LLC dba Tech Defenders","601 Maryland Ave NE, Grand Rapids, MI, United States",Michigan, , , ,www.techdefenders.com,Electronics Recyclers,Electronics Recycler,Electronics,42.9738219887828,-85.6119400382098,562920
Resale Resource Corporation,"101 Esplanade Blvd, 400, Houston, TX, United States",Texas, , , ,www.r2corp.net,Electronics Recyclers,Electronics Recycler,Electronics,29.9358150176405,-95.4058059842353,562920
Resale Resource Corporation,"10200 McKalla Place, Suite 200, Austin, TX, United States",Texas, , , ,www.resaleresource.net,Electronics Recyclers,Electronics Recycler,Electronics,30.3842939857321,-97.7206380282159,562920
Resale Technologies,"3065 E 14th Ave, Columbus, OH, United States",Ohio, , , ,www.resaletech.com,Electronics Recyclers,Electronics Recycler,Electronics,39.9932149983912,-82.9237760151381,562920
"Resource Regeneration, LLC dba S3 Recycling Solutions","901 Central Ave W, Springfield, TN, United States",Tennessee, , , ,www.s3rs.com,Electronics Recyclers,Electronics Recycler,Electronics,36.5034689970797,-86.8974069817446,562920
"RET3 Job Corp., Inc","1814 East 40th street, Cleveland, OH, United States",Ohio, , , ,www.ret3.org,Electronics Recyclers,Electronics Recycler,Electronics,41.5086819937028,-81.6596489779928,562920
Revalue Tech LLC,"1EA Chimney Rock Rd, Bridgewater, NJ, United States",New Jersey, , , ,www.revaluetech.com,Electronics Recyclers,Electronics Recycler,Electronics,40.5616909578582,-74.5651815735815,562920
"Reverse Tech, LLC dba eSCO Processing and Recycling","920 N Glenstone, Springfield, MO, United States",Missouri, , , , ,Electronics Recyclers,Electronics Recycler,Electronics,37.2173540141515,-93.2600080097374,562920
"Rexi, Inc DBA Rexi Resale","800 W. Sandy Lake Rd., Suite 100, Coppell, TX, United States",Texas, , , ,www.rexiresale.com,Electronics Recyclers,Electronics Recycler,Electronics,32.9751040055302,-97.0178400059313,562920
"Richland Newhope Industries, Inc.","971 W. Longview Avenue, Mansfield, OH, United States",Ohio, , , ,http://www.rniinc.com/,Electronics Recyclers,Electronics Recycler,Electronics,40.7758649814762,-82.5490099762329,562920
"RMG Enterprise, LLC / Recycled Materials Group","18 Celina Ave, Unit 6-10, Nashua, NH, United States",New Hampshire, , , ,www.rmgenterprise.com,Electronics Recyclers,Electronics Recycler,Electronics,42.7994629800318,-71.5438420099876,562920
"Rochester Computer Recycling & Recovery, LLC dba ESOURCE+ DBA Electronics Cafe dba EWASTE+","705 Prestige Parkway, Corporations Park, Scotia, NY, United States",New York, , , , ,Electronics Recyclers,Electronics Recycler,Electronics,42.8364223011923,-73.9803067606667,562920
"Rochester Computer Recycling & Recovery, LLC dba ESOURCE+ DBA Electronics Cafe dba EWASTE+","7318 Victor Mendon Road, Victor, NY, United States",New York, , , ,www.ewaste.com,Electronics Recyclers,Electronics Recycler,Electronics,42.9950011733555,-77.4331513740786,562920
"Rochester Computer Recycling & Recovery, LLC dba ESOURCE+ DBA Electronics Cafe dba EWASTE+","97 North Water St., Ossining, NY, United States",New York, , , , ,Electronics Recyclers,Electronics Recycler,Electronics,41.1642068478101,-73.8700515397815,562920
"Rockaway Recycling, Inc","311 West Main Street, Rockaway, NJ, United States",New Jersey, , , ,www.RockawayRecycling.com,Electronics Recyclers,Electronics Recycler,Electronics,40.8952069798929,-74.5183360364839,562920
"RSR Partners, LLC dba Regency Technologies","11600 S. Burley Ave., Chicago, IL, United States",Illinois, , , ,www.regencytechnologies.com,Electronics Recyclers,Electronics Recycler,Electronics,41.691276012776,-87.5469309685504,562920
"RSR Partners, LLC dba Regency Technologies","1815 E. Deer Valley Dr., Phoenix, AZ, United States",Arizona, , , ,www.regencytechnologies.com,Electronics Recyclers,Electronics Recycler,Electronics,33.6877047537611,-112.043451084141,562920
"RSR Partners, LLC dba Regency Technologies","2005 Broad Street, Brooksville, FL, United States",Florida, , , ,www.regencytechnologies.com,Electronics Recyclers,Electronics Recycler,Electronics,28.4615069806864,-82.4489850376029,562920
"RSR Partners, LLC dba Regency Technologies","2501 N Great Southwest Pkwy, Grand Prairie, TX, United States",Texas, , , ,www.regencytechnologies.com,Electronics Recyclers,Electronics Recycler,Electronics,32.7923140175606,-97.0479590338878,562920
"RSR Partners, LLC dba Regency Technologies","2710 Weck Dr., Durham, NC, United States",North Carolina, , , ,http://www.regencytechnologies.com,Electronics Recyclers,Electronics Recycler,Electronics,35.9290740200919,-78.851195005165,562920
"RSR Partners, LLC dba Regency Technologies","2989 Humphries Hill Road, Austell, GA, United States",Georgia, , , ,www.regencytechnologies.com,Electronics Recyclers,Electronics Recycler,Electronics,33.8100379956002,-84.6427639595432,562920
